uniqueID,drugName,condition,review,rating,date,usefulCount,trueSentiment
91672,Xyrem,Narcolepsy,"""I have been on this medication for narcolepsy with cataplexy since 2013. It's the only drug to have helped me be able to keep driving, and be awake during the day when I'm supposed to and sleep so good at night. It's truly a blessing!!! The side effects are nonexistent for the most part.

I highly recommend it!!!""",10,25-Oct-15,25,positive
99937,Magnesium sulfate / potassium sulfate / sodium sulfate,Bowel Preparation,"""This medication should be outlawed for its horrible taste!!! I couldn't finish it all. And FYI for those of you worrying about SuPrep not working...my doctor said some people have no results until after the second cup!""",2,18-Jan-16,10,negative
179734,Adapalene / benzoyl peroxide,Acne,"""I've been using epiduo for 10 days today. I honestly have to say ""IT WORKS!"" I've had acne for as long as I can remember. It's started on my forehead and just started to work its way down my face. I had a combination of whiteheads, blackheads and dark spots EVERYWHERE! Now my forehead is clear and my cheeks are well on they're way. I'm experiencing the burning and itchy irritation as many others are. I think I'll keep using mine cause it cost so much and it actually works. It's like getting apart of your life you never really got to have. I wore less make up in the first 5 days. It sucks to use but it's worth having clear skin!""",9,21-Mar-16,7,positive
115977,Divalproex sodium,Migraine Prevention,"""I have been on Depakote ER for three weeks.  I've had 4 migraines during this time, which is less than before the Depakote ER.  My GP had me on three different medicines for prevention but the neurologist switched me to Depakote ER.  I've had a little weight gain. The problem is I'm on weight watchers and should be losing weight. There have been times where my hands have felt shaky (similar to too much caffeine intake).  I think its also effecting my vision. I'm going to call the doctor and ask to switch to something else. Basically its helped reduced my migraine frequency but not enough to live with the side effects.""",8,7-Sep-11,20,neutral
189403,Oxycodone,Pain,"""I see so many people here rating this medicine as a lifesaver, and especially thankful because it allows them to play with their kids. Its the same for me. I still have a very low quality of life and spend a lot of time in bed, but without it I would barely be human.""",7,23-Jul-12,102,positive
90533,Docosanol,Herpes Simplex,"""Abreva sucks I don't get cold sores myself but my boyfriend does and every time he used abreva like it says when you start to feel it coming on he'd use it but abreva seems to only make it WORSE and puff out. So some lady said to try GLY OXIDE you can find it at any drug store but it works 10000 times better than abreva. Just thought I'd leave this thought with some of you maybe you can try it too.""",1,31-Dec-15,17,negative
1653,Eluxadoline,Irritable Bowel Syndrome,"""I have taken both the 75 mg and the 100 mg Viberzi,  When I started on this medication, 75 mg it worked somewhat.  My diarrhea was slowed and the stool more solid.  However, after being on it for a month or a little longer the benefits decreased.  I went from having 3 to 4 bowel movements a day, to having 6 or more.  Usual pattern was first movement was the most solid, the next ones were more loose and runny.  My doctor increased the strength of Viberzi to the 100mg.  Same basic issues...worked good at first but after using for a while, I was back to having 6 or more movements with the first one the most solid.  I am again trying the lower dose as the cost of the 100mg was way too expensive, even with Medicare and my supplement drug plan.""",3,17-Mar-16,19,negative
53061,Bevacizumab,Colorectal Cance,"""Avastin has stopped progression of my colon cancer.
Cutting off the fresh blood supply and nutrition that feeds the main tumor.""",10,24-Jul-13,41,positive
439,Medroxyprogesterone,Amenorrhea,"""I have taken Provera once before to help regulate my period. My menstrual cycle is very irregular (I can go up to 6 months between cycles with some cycles lasting up to 3 months) and it seemed to have worked after the first time taking it. However, after six months or so my periods became irregular once again. I've just started taking it for the second time and it seems to be working, although I will have to say it's given me some pretty intense mood swings.""",9,12-Oct-13,11,neutral
75971,Pioglitazone,"Diabetes, Type 2","""I have been taking this drug for one month and I feel so much better and my sugar is in control. I noticed that my digestive problems mostly disappeared when I started taking this drug. My IBS is much better. The swelling and bloating in my abdomen has reduced greatly. So far I have not had any noticeable side effects. I take 15mg daily.""",10,18-Aug-08,37,positive
199719,Varenicline,Smoking Cessation,"""I had no side effects. It was so easy for me.""",10,13-May-17,4,positive
213636,Tioconazole,Vaginal Yeast Infection,"""So I purchased the monistat 1 ovule Monday night and inserted it around 9 something. As I was laying down I started to read the reviews on here and got scared for me life because I was scared that I would endure that burning and itching. I actually didn't have any problems with that... but the second time I put the external cream on I damn near died. It burned so bad that I hurried up and ran to the bathroom to take a shower. I think I used it too close in time... but it's now the next day and I feel wonderful no more itching or burning just discharge still from the medicine coming out""",9,3-May-17,8,positive
184899,Canagliflozin,"Diabetes, Type 2","""I was prescribed Invokana for high glucose (Prediabetes), not diabetic yet.  I have been on the medicine a little over a month.  I developed a yeast infection and my hair is shedding a lot--handfuls at a time. Dermatologist said it would shed for up to 10 more weeks. What a horrible side effect that is not mentioned anywhere!  I stopped taking the medicine.""",1,8-Sep-14,84,negative
172732,Clonazepam,Bipolar Disorde,"""Klonopin helps my social anxiety and generalized anxiety disorder associated with Bipolar Disorder I. I've been taking 1mg twice per day for 8 years and works great. I'm able to get things done without thinking something terrible is going to happen.""",10,30-Apr-15,55,positive
166960,Levonorgestrel,Birth Control,"""I have had the Skyla for about a year now and I must say when I got it inserted I thought I was going to die! The process was quick but the pain was unbearable after. I've always had bad cramps and heavy bleeding but now all of that has tapered off since I've had it so long. I haven't had a period in about a month but I can say the only thing I don't like is the heavy discharge. I'm 23 with one child and an IUD was my only choice due to health reasons. Good luck to you all ladies!""",9,4-Jul-16,4,neutral
175482,Augmentin,Strep Throat,"""Completely useless medication. Been taking this for 5 days and absolutely none of my symptoms have cleared up. This morning I woke up with a pounding headache and I am about to throw up. Avoid at all costs""",1,19-Aug-16,15,negative
190468,Vigamox,"Conjunctivitis, Bacterial","""I have difficulties using prescription eyedrops because most contain a preservative called benzalkonium chloride that I'm allergic too - my eyes get red, irritated and burn. This eye drop does not have the preservative. It was a life saver for my conjunctivitis! Within 2 days it started to clear up - the drops were easily tolerated.""",10,30-Jan-17,3,positive
23713,Chlorzoxazone,Muscle Spasm,"""I really don't think parafon forte helped me too well. I really didn't feel any different as far as the muscle spasms, because they were still as bad as they were before. I've switched to 2mg Valium as it has helped tremendously. Plus, Valium helps with my anxiety as well. A quick fact from what I read in my pamphlet on 2mg Valium that it's purposes are for muscle spasms, anxiety, and acute alcohol withdrawals. I never knew about it helping with acute alcohol withdrawals too. You learn something new everyday.""",5,31-Oct-09,28,negative
59151,Rotigotine,Restless Legs Syndrome,"""My last 5 years with RLS has has been one big circle - trying to find the right doctor who really knows something about the syndrome, thinking I found that doctor, changing meds which help for a few years then back to the nightly walks around the house, no sleep for days then the 'crash sleep' when the RŁS eases off, the miserable grogginess after the crash... Then I found a Movement Disorder Doctor who prescribed NEUPRO patches.  They also worked wonderfully for a year or so but I'm back into the 'circle.'  The NEUPRO patch is probably the best med I've tried so far but, unfortunately, it augmented too.  We're now trying a new form of Gabapentin in addition to the patch.  Hopefully this will do something to ease the nerves.""",5,7-Sep-16,10,neutral
94655,Abilify,Schizoaffective Disorde,"""Having increased hallucinations and paranoia, and feeling isolated.  this is making it hard to get out with people, and I have been on 10mg.  Good things are I am feeling more active in general, taking better care of myself.  Not too happy with the amount of voices that occur when on this med.  It has made me more hungry, and restless.""",4,27-Jan-16,12,neutral
115800,Divalproex sodium,Bipolar Disorde,"""I just took my first dose & am hopeful yet apprehensive. Hoping to see what others are experiencing.""",6,12-Jan-17,3,neutral
27139,Sklice,Head Lice,"""I used the product twice. I coated entire head as directed and let it sit for 40 minutes. The second time, I used a tube and a half and made sure it stayed on my head for the same time - far longer than the required 10 minutes before rinsing out, and didn't wash hair for two days. After both uses, I still felt itching, crawling. And this after going through the lice song and dance routine (washing, sterilizing everything I have ever come in contact with, passed by, looked at, breathed on, thought about, replacing combs, accessories, etc, etc, etc.). Several nits were found in my hair after this. My daughter did the same with her family. I pulled live lice from her hair last night. """,2,8-Jul-17,5,negative
189256,Oxycodone,Chronic Pain,"""I have chronic pancreatitis-cause unknown (I do not drink alcohol). The pain from this disease is constant and severe. I take Oxycontin 30 mg twice daily and it is very effective in controlling the pain and keeping it, for the most part, at a tolerable level (about 4-5 on the 1-10 pain scale). For occasional episodes of breakthrough pain, which can be very bad, I have oral Dilaudid 2 mg. I do not take this often, only when needed. It helps me avoid trips to the ER for pain control. Dilaudid is not often prescribed for home use. I'm under the care of a pain specialist. Neither my GI nor endocrinologist can prescribe schedule II narcotics. Chronic pancreatitis is one of the most painful diseases a person can have.""",9,11-May-14,103,positive
175032,Fingolimod,Multiple Sclerosis,"""I was in clinical trial and continued on Gilenya for 5 years after. Overall awesome medicine regarding management of my multiple sclerosis progression based on MRI of brain. Symptoms did worsen over time as it is not a cure and well progression happens. Made decision with Neuro to switch to another treatment (Aubagio) due to lesions showing on spine and a black hole showing on brain MRI - never had side effects to mention except maybe additional tiredness after dosing, switched to nights for 3 months but then went back to mornings. Blood pressure ran low from an hour till about 3 hours following dosage but never to a point of dizzy or passing out. Was usually 50/70 to 60/80 which freaked out nurses but my BP was always around 80-82. I recommend it!""",9,14-Nov-14,43,positive
95995,Sertraline,Depression,"""I was on Zoloft years 9 years ago for social anxiety and it worked great for me. I decided to get off it but slowly all my symptoms came back. Also got very depressed. Got back in Zoloft 7 months ago and I feel great again. I did have to get a night guard from my dentist. I chipped two from teeth and cracked a molar from grinding my teeth. 200mg daily.""",9,22-Mar-13,85,positive
182482,Angeliq,Postmenopausal Symptoms,"""Have taken Angeliq for 4 years, and feel very well. Has eliminated dryness and mood swings, also great improvement, hair, nails etc. No weight gain, but slightly painful breasts during initial months, but now okay. Would recommend this hormone replacement therapy. Had tried others eg.Femoston, Livial and Estrocombi but this is the best of all and will keep taking for as long as possible.""",10,8-Feb-14,55,positive
13389,Amphetamine / dextroamphetamine,ADHD,"""I've tried straterra, Dexedrine, Ritalin, vyvanse.  I would take vyvanse but it's way too $$.  Generic adderall has been the best as far as cost and effects.  The only thing I have disliked is the connotation adderall has because I can tell some doctors are against it. I have had two doctors lecture me on how something else must be wrong because I take 75 mg daily.  I tried to switch to the XR and lower my dose to 60mg, but insurance won't cover it.  This medication has been really helpful for me, but I feel like I need it because without it I'm a wild ape (hyper, make silly noises, annoying). It keeps me calm and focused on the big picture.  I would use modafilin if I could because the side effects are less pronounced, but again the price.""",8,1-Sep-15,35,positive
59304,Zyrtec,Allergic Rhinitis,"""It didn't work, no effect whatsoever""",1,30-Apr-17,2,negative
3495,Nitrofurantoin,Urinary Tract Infection,"""Dr. gave for UTI and 100 mg twice a day for 10 days.  first day took one

and night had terrible pain in the stomach, next day took 2 and that night

my throat swelled............that was it and I read the side effects, I  had two

that was enough for me since I had spent three nights in ICU at hospital

a couple of years earlier for swollen tongue from allergic reaction to Lisinprol for

blood pressure.............I did not want to take that kind of chance. 

I am sure there is other medicine out there, but he felt I didn't give it a chance.

It looks like you can have different reactions at different times...meaning it doesn't bother you one time you take it but it can the next time. side effects deadly.""",1,21-Sep-15,3,negative
202270,Benzoyl peroxide / clindamycin,Acne,"""I used this medication along with a benzoyl peroxide wash.  I agree, it has worked miracles for me.  I use them both at night and in the morning and it is very drying.  I don't mind that it dries my skin out, however, because it caused my skin to peel which made my scars go away very quickly. Sometimes I avoid using the cream on my face in the morning and just put lotion on because no one wants their face peeling during the day.""",9,5-Mar-14,14,positive
79687,Insulin glargine,"Diabetes, Type 2","""The drug is very effective. The only problems I have had are low blood sugar levels while working in hot environments. In Saudi in the spring and summer months I would constantly go low while working in the heat.""",8,10-May-09,39,neutral
124765,Omega-3 polyunsaturated fatty acids,Hypertriglyceridemia,"""Worked very well.  Triglicerides went from 2,000 to 600 in just 3 weeks.  The only medication that worked for me.""",10,12-May-12,45,positive
145366,Zithromax,Sinusitis,"""It's a life saver for me.  Chronic sinus problem that occurs twice a year.  Slight stomach issues after initial dose.  Knocks out brain fog.  Had the best night sleep in months.  Always take with food, and you will have no issues.  Made me feel 90% better 24 hours after initial dosage.  Use with Flonase to open passages to help get it all.  Only thing that works for my sinus problems.""",10,7-Dec-15,62,positive
90759,Chateal,Birth Control,"""I was on Reclipsen and moved and started going to Planned Parenthood to get my birth control quicker and one month they switched me and gave me Chateal. I was told this is the same thing and let me just say THIS IS NOT THE SAME. This bc made me have severe migraine headaches that would not go away no matter what medicine I took. The migraines would come every month 3 to 1 days before my period started. They were so unbearable that I would have to lay in the dark completely still and not move my head in any direction. Not to mention I gained 30 pounds. So after 6 months I let them know that I would not take this anymore and to please give me Reclipsen again. Instead they gave me Apri and everything has gotten back to normal. No more migraine""",1,8-Sep-15,2,negative
66199,Valacyclovir,"Herpes Simplex, Suppression","""I typically don't write reviews.  But almost a year of taking and not any  outbreaks. Great med. And gave me my life back.  

I am healed in Jesus' name. 



Hsv- 2 survivor.""",10,3-Nov-16,72,positive
127874,Phentermine,Weight Loss,"""Have been taking the 30mg pills for 7 weeks now I've lost 30 pounds and after the 5th week or so I stopped sweating as much but now I'm having issues with going to the toilet been about 4 days. Other than that the pills work amazing""",8,8-Dec-16,5,positive
149506,Mirena,Birth Control,"""I am 56 and had the Mirena inserted 4 years ago because I'd had heavy continuous bleeding for months.  It was Mirena or surgery.  The insertion was extremely painful, but the  bleeding stopped almost completely within a couple of weeks. I had lots of problems with the strings ""stabbing"" me in the vagina for almost the entire first year.  I finally went to a different doctor who trimmed about 3&1/2 inches of string.  Haven't had any problem since. I have not enjoyed sex since it was inserted, I lost a lot of hair, gained 20 pounds within the first six months, and have had to take anti depressants daily.  I never had problems with depression before.  But hey - no more bleeding.""",2,18-Jan-13,23,neutral
26015,Dupilumab,Eczema,"""I have now been using Dupixent for about a month. I've had eczema for my whole life (all 48 years). Treatments I've previously used were cortisone creams (Diprolene & Clobetasol), antihistamines, regular application of emollients, anti itch creams, bleach baths. All just reduced flare ups but nothing ever made my eczema truly better. It has always been present even when most allergens were not present (i.e., in the winter). Dupixent is supposed to take several months to work, but I noticed that my skin was clearing up 4 days after the initial loading dose. Since then my skin has continued to show improvement with dramatically reduced redness and progressively less itchiness.""",10,23-Aug-17,18,positive
173188,Clonazepam,Anxiety,"""Works great for anxiety.""",10,6-Apr-11,12,positive
35967,Buprenorphine / naloxone,Opiate Dependence,"""Works great for chronic pain.""",10,30-Jan-12,13,positive
96249,Sertraline,Premenstrual Dysphoric Disorde,"""I have dealt with PMS for years. I finally found a doctor willing to listen and try to help. After discussing symptoms with her I was diagnosed with PMDD and put on Zoloft. In a matter of days I felt better than I have in years. It does tend to make me sleepy so I take it at night. Having a proper diagnosis and treatment saved my marriage, my job and my relationships with others.""",9,8-Mar-12,106,positive
205733,Pristiq,ibromyalgia,"""I've been using Pristiq for two and half months to control my chronic ear pain and depression.  Like most antidepressants there are side-effects.  Looking back it wasn't always easy, but I would do it again.""",9,3-Feb-11,11,positive
171288,Levitra,Erectile Dysfunction,"""Results were astonishing, slight facial flushing the only side effect noted. Also, seems to have helped with lower leg cramping, due to back surgery-nerve damage. No more cramping with ejaculation. Have had difficulty for 5-6 years, but not anymore, and my wife is even more impressed than I am. Thanks..(retired R.N.)""",10,19-Sep-09,53,positive
101352,Aubra,Birth Control,"""I've just completed my first week I've experienced so far anxiety, sudden fleeting waves of nausea, appetite increase ,acne , mood swings, worsening depression I hope it gets better""",9,18-Aug-16,1,neutral
139062,Phentermine,Weight Loss,"""I started taking Adipex in January of 2008.  At that time I weighed 230 lbs.  Today I weigh 170 lbs and still losing. Lost 60 lbs.""",10,5-Jun-09,30,positive
193429,Cyclobenzaprine,Fibromyalgia,"""When I first had pain 19 years ago, I was treated with Flexeril for six months.  I thought I was getting better.  I stopped taking Flexeril and it was a false feeling of wellness.  Two months later I was diagnosed with Fibromyalgia.  Now I am on Flexeril again after a car accident and it is helping. I only plan to stay on it a few weeks since I fear addiction.""",9,6-May-11,21,positive
104430,Ethinyl estradiol / levonorgestrel,Abnormal Uterine Bleeding,"""I was a little hesitant to try LoSeasonique due to all of the negative reviews, but thought it was worth a shot at no longer having a period every month, since I struggle with heavy periods for 11 days every month.  I have just finished taking my first pack and never once experienced spotting during the three months on this pack.  Nor did I have any changes in skin, weight or cramping.  My sex drive even increased. Some factors that may have helped ease my body onto this pill so smoothly might relate to the fact that I took the pill at the same time everyday and have been on birth control for about nine years. Everyone's body reacts differently, so it may be worth taking the risk.  I for one am very pleased with this pill.""",10,13-Dec-11,8,positive
57672,Acetaminophen / hydrocodone,Rheumatoid Arthritis,"""This medicine helps me tolerate physical therapy after my knee replacement. It also secures a good night's sleep.""",9,6-Feb-15,21,positive
192569,Drospirenone / ethinyl estradiol,,"""I miss Yaz! My insurance company won't cover the brand name now that it's got a generic (Gianvi). I was on Yaz for 4 years, and I had a great experience. My acne went away completely, PMS was more tolerable, my periods were short (3 days), and my breasts even grew, which I really like! The only problem was that I had to stop wearing contacts because my eyes got dry, but the drying effect only bothered my eyes with Yaz. Definitely would recommend!""",8,4-Mar-12,3,positive
44351,Ethinyl estradiol / norgestimate,Birth Control,"""I was on Trinessa for 7 years. The past 6-7 months I have been getting very emotional while on my period week. It started out gradual and then was getting worse as the months go on. I would just start crying over NOTHING! I went to the doctor and she switched me to LoSeasonique BUT I'm going to get off of that because I have been spotting pretty bad and I still can't get over the fact of not having a period except for 4 times per year, seems very unnatural. Before Trinessa, I was on Orth-tri-cyclen lo and I had bad migraines.""",5,16-Oct-10,4,negative
144679,Etonogestrel,Birth Control,"""Reading these reviews Really helped I knew it was this BC!! Ok I have had the nexplanon for like 10 months when I say my mood swings are the worst and the weight gain is ridiculous I was never a small girl but I was never huge tho!!! My sex drive does not exist like I really had to sit down a few days ago and think about what was wrong with me and the birth control is the only difference I have made since then. The depression and mood swings is crazy I will be scheduling me an appt to get this thing taken out. I just be yelling at my boyfriend and thats when it hit me because Im really laid back and cool this thing has to get out my arm""",3,7-Mar-16,5,negative
38447,Phenazopyridine,Interstitial Cystitis,"""Didn't work for me. Made me nauseous. I took with meal. Took again next day and made me vomit.""",1,3-Feb-15,17,negative
141818,Escitalopram,Anxiety,"""I had a rough time last year.  I was diagnosed with a terrible illness and it took me months to recover both physically and mentally.  And, to add insult to injury, I was a new mother.  I honestly lost myself in anxiety and sadness and refused to believe I needed medication to get back to myself.  But with therapy and a six-month trial of Lexapro, I came back to being me.  I had some nausea at first, but it subsided within a week or so.  And, when it was right for me to come off the medication, I did it under a doctor's care - gradually.  Lexapro worked for me by helping me focus on both on cognitive therapy and on moving on from the trauma.""",9,13-Sep-11,19,positive
103639,Acetaminophen / pseudoephedrine,Sinus Symptoms,"""I have used Ornex for as long as I can remember and am extremely disappointed that it was taken off the market. It helped almost immediately and now I have to fish around and find something that will work as well. There was no dry mouth and the effectiveness was great. Please put it back on the market.""",10,8-Jul-12,11,positive
61827,Xyzal,Allergic Rhinitis,"""OMG worst ever. I stocked up using all of the $5.00 off coupons and what a waste of money. I realize this year is double dose of pollen but this medicine didn't help. Gave me bad headaches and listless and tired.""",1,1-May-17,7,negative
228507,Geodon,Schizophrenia,"""Took 80mg of geodon for 10 months. Severe weight loss, extreme loss appetite, moderate anxiety, talked out loud to myself alot, talking rapidly while not making sense, extreme happiness for no reason, jerked awake every night with no sleep for at least 24 hours, severe restlessness. Extreme energy.  Severe weight loss almost died. Don't recommend.""",1,8-Apr-16,11,negative
